{
  "$schema": "https://json-schema.org/draft/2020-12/schema",
  "$id": "https://github.com/tt-a1i/archify/schemas/architecture.schema.json",
  "title": "Archify Architecture Diagram",
  "type": "object",
  "additionalProperties": false,
  "required": [
    "schema_version",
    "diagram_type",
    "meta",
    "components"
  ],
  "properties": {
    "schema_version": {
      "const": 1
    },
    "diagram_type": {
      "const": "architecture"
    },
    "meta": {
      "type": "object",
      "additionalProperties": false,
      "required": [
        "title",
        "output"
      ],
      "properties": {
        "title": {
          "type": "string",
          "minLength": 1
        },
        "locale": {
          "$ref": "common.schema.json#/$defs/locale"
        },
        "translations": {
          "$ref": "common.schema.json#/$defs/translations"
        },
        "subtitle": {
          "type": "string"
        },
        "output": {
          "$ref": "common.schema.json#/$defs/portableOutputPath"
        },
        "animation": {
          "$ref": "common.schema.json#/$defs/animation"
        },
        "visual_preset": {
          "$ref": "common.schema.json#/$defs/visualPreset"
        },
        "quality_profile": {
          "$ref": "common.schema.json#/$defs/qualityProfile"
        },
        "engineering_profile": {
          "enum": [
            "deployment-ownership"
          ]
        },
        "repository": {
          "$ref": "common.schema.json#/$defs/repository"
        },
        "views": {
          "$ref": "common.schema.json#/$defs/guidedViews"
        },
        "legend": {
          "type": "object",
          "additionalProperties": false,
          "properties": {
            "mode": {
              "$ref": "common.schema.json#/$defs/legendMode"
            },
            "entries": {
              "type": "object",
              "additionalProperties": false,
              "properties": {
                "frontend": {
                  "$ref": "common.schema.json#/$defs/legendEntry"
                },
                "backend": {
                  "$ref": "common.schema.json#/$defs/legendEntry"
                },
                "database": {
                  "$ref": "common.schema.json#/$defs/legendEntry"
                },
                "cloud": {
                  "$ref": "common.schema.json#/$defs/legendEntry"
                },
                "security": {
                  "$ref": "common.schema.json#/$defs/legendEntry"
                },
                "messagebus": {
                  "$ref": "common.schema.json#/$defs/legendEntry"
                },
                "external": {
                  "$ref": "common.schema.json#/$defs/legendEntry"
                }
              }
            }
          }
        },
        "viewBox": {
          "type": "array",
          "prefixItems": [
            {
              "type": "number",
              "minimum": 320
            },
            {
              "type": "number",
              "minimum": 240
            }
          ],
          "items": false,
          "minItems": 2,
          "maxItems": 2
        },
        "relationship_font_size": {
          "type": "number",
          "minimum": 8,
          "maximum": 16
        }
      }
    },
    "layout": {
      "type": "object",
      "additionalProperties": false,
      "required": [
        "mode"
      ],
      "properties": {
        "mode": {
          "enum": [
            "grid"
          ]
        },
        "origin": {
          "$ref": "common.schema.json#/$defs/point"
        },
        "cols": {
          "type": "integer",
          "minimum": 1,
          "maximum": 12
        },
        "gapX": {
          "type": "number",
          "minimum": 0
        },
        "gapY": {
          "type": "number",
          "minimum": 0
        },
        "cellW": {
          "type": "number",
          "minimum": 40
        },
        "cellH": {
          "type": "number",
          "minimum": 24
        }
      }
    },
    "components": {
      "type": "array",
      "minItems": 1,
      "items": {
        "type": "object",
        "additionalProperties": false,
        "required": [
          "id",
          "type",
          "label"
        ],
        "properties": {
          "id": {
            "$ref": "common.schema.json#/$defs/id"
          },
          "type": {
            "$ref": "common.schema.json#/$defs/componentType"
          },
          "label": {
            "type": "string",
            "minLength": 1
          },
          "sublabel": {
            "type": "string"
          },
          "tag": {
            "type": "string"
          },
          "icon": {
            "$ref": "common.schema.json#/$defs/nodeIcon"
          },
          "brand": {
            "$ref": "common.schema.json#/$defs/brandMark"
          },
          "sources": {
            "$ref": "common.schema.json#/$defs/sourceReferences"
          },
          "row": {
            "type": "integer",
            "minimum": 0
          },
          "col": {
            "type": "integer",
            "minimum": 0
          },
          "pos": {
            "$ref": "common.schema.json#/$defs/point"
          },
          "size": {
            "type": "array",
            "prefixItems": [
              {
                "type": "number",
                "exclusiveMinimum": 0
              },
              {
                "type": "number",
                "exclusiveMinimum": 0
              }
            ],
            "items": false,
            "minItems": 2,
            "maxItems": 2
          },
          "shape": {
            "enum": [
              "process",
              "decision",
              "terminator",
              "data"
            ]
          },
          "fields": {
            "type": "array",
            "items": {
              "type": "object",
              "additionalProperties": false,
              "required": [
                "name",
                "type",
                "key",
                "nullable",
                "default",
                "reference"
              ],
              "properties": {
                "name": {
                  "type": "string"
                },
                "type": {
                  "type": "string"
                },
                "key": {
                  "type": "string"
                },
                "default": {
                  "type": "string"
                },
                "reference": {
                  "type": "string"
                },
                "nullable": {
                  "type": "boolean"
                }
              }
            }
          },
          "constraints": {
            "type": "array",
            "items": {
              "type": "string"
            }
          }
        }
      }
    },
    "boundaries": {
      "type": "array",
      "items": {
        "type": "object",
        "additionalProperties": false,
        "required": [
          "kind",
          "label",
          "wraps"
        ],
        "properties": {
          "kind": {
            "enum": [
              "region",
              "security-group"
            ]
          },
          "label": {
            "type": "string",
            "minLength": 1
          },
          "wraps": {
            "type": "array",
            "minItems": 1,
            "items": {
              "$ref": "common.schema.json#/$defs/id"
            }
          },
          "pad": {
            "type": "number",
            "minimum": 0
          }
        }
      }
    },
    "connections": {
      "type": "array",
      "items": {
        "type": "object",
        "additionalProperties": false,
        "required": [
          "from",
          "to"
        ],
        "properties": {
          "id": {
            "$ref": "common.schema.json#/$defs/id"
          },
          "from": {
            "$ref": "common.schema.json#/$defs/id"
          },
          "to": {
            "$ref": "common.schema.json#/$defs/id"
          },
          "label": {
            "type": "string"
          },
          "variant": {
            "$ref": "common.schema.json#/$defs/variant"
          },
          "fromSide": {
            "$ref": "common.schema.json#/$defs/side"
          },
          "toSide": {
            "$ref": "common.schema.json#/$defs/side"
          },
          "route": {
            "enum": [
              "auto",
              "straight",
              "orthogonal-h",
              "orthogonal-v"
            ]
          },
          "via": {
            "type": "array",
            "items": {
              "$ref": "common.schema.json#/$defs/point"
            }
          },
          "labelAt": {
            "$ref": "common.schema.json#/$defs/point"
          },
          "labelDx": {
            "type": "number"
          },
          "labelDy": {
            "type": "number"
          },
          "labelSegment": {
            "type": "integer",
            "minimum": 0
          },
          "width": {
            "$ref": "common.schema.json#/$defs/relationshipWidth"
          },
          "start_cap": {
            "enum": [
              "ERD_EXACTLY_ONE",
              "ERD_ZERO_OR_ONE",
              "ERD_ZERO_OR_MORE",
              "NONE",
              "ARROW_LINES"
            ]
          },
          "end_cap": {
            "enum": [
              "ERD_EXACTLY_ONE",
              "ERD_ZERO_OR_ONE",
              "ERD_ZERO_OR_MORE",
              "NONE",
              "ARROW_LINES"
            ]
          }
        }
      }
    },
    "cards": {
      "$ref": "common.schema.json#/$defs/cards"
    }
  }
}
